<!ELEMENT rutas (ruta+)>
<!ELEMENT ruta (nombre, tipo, medio_transporte, fecha_inicio?, hora_inicio?, duracion, agencia, descripcion, personas, inicio, referencias, recomendacion, hitos, planimetria, altimetria)>
<!ELEMENT nombre (#PCDATA)>
<!ELEMENT tipo (#PCDATA)>
<!ELEMENT medio_transporte (#PCDATA)>
<!ELEMENT fecha_inicio (#PCDATA)>
<!ELEMENT hora_inicio (#PCDATA)>
<!ELEMENT duracion (#PCDATA)>
<!ELEMENT agencia (#PCDATA)>
<!ELEMENT descripcion (#PCDATA)>
<!ELEMENT personas (#PCDATA)>
<!ELEMENT inicio (lugar, direccion, coordenadas)>
<!ELEMENT lugar (#PCDATA)>
<!ELEMENT direccion (#PCDATA)>
<!ELEMENT coordenadas (latitud, longitud, altitud)>
<!ELEMENT latitud (#PCDATA)>
<!ELEMENT longitud (#PCDATA)>
<!ELEMENT altitud (#PCDATA)>
<!ELEMENT referencias (referencia+)>
<!ELEMENT referencia (#PCDATA)>
<!ELEMENT recomendacion (#PCDATA)>
<!ELEMENT hitos (hito+)>
<!ELEMENT hito (nombre, descripcion, coordenadas, distancia, galeria_fotos, galeria_videos?)>
<!ELEMENT distancia (#PCDATA)>
<!ATTLIST distancia unidad CDATA #REQUIRED>
<!ELEMENT galeria_fotos (foto+)>
<!ELEMENT foto (#PCDATA)>
<!ATTLIST foto archivo CDATA #REQUIRED>

<!ELEMENT galeria_videos (video*)>
<!ELEMENT video (#PCDATA)>
<!ATTLIST video archivo CDATA #REQUIRED>
<!ELEMENT planimetria EMPTY>
<!ATTLIST planimetria archivo CDATA #REQUIRED>
<!ELEMENT altimetria EMPTY>
<!ATTLIST altimetria archivo CDATA #REQUIRED>